Acronym,Authors,Year,LongDescription,Journal,Detailed.Definition
AbnormalAccruals,Xie,2001,Abnormal Accruals,AR,"Define Accruals as net income (ib) minus operating cash flow (oancf), divided by average total assets (at) for years t-1 and t. If oancf is missing, replace operating cash flow with funds from operations (fopt) minus the annual change in total current assets (act) plus the annual change in cash and short-term investments (che) plus the annual change in current liabilities (lct) minus the annual change in debt in current liabilities (dlc). For each year t and 2-digit sic code, regress Accruals on: the inverse of average total assets for year t-1, the change in revenue (sale) from year t-1 to t divided by total assets for t-1, propery plant and equipment (ppegt) divided by total assets for t-1.  AbnormalAccrual is the residual from this cross-sectional regression.  See code for more details."
Accruals,Sloan,1996,Accruals,AR,"Accruals = ( (act - l12.act) - (che - l12.che) - ( (lct - l12.lct) - (dlc - l12.dlc) - (tempTXP - l12.tempTXP) ) - dp ) / ( (at + l12.at)/2), where tempTXP is either txp or 0 (if txp is missing)."
AccrualsBM,Bartov and Kim,2004,Book-to-market and accruals,RFQA,"Binary variable equal to 1 if stock is in the highest Accrual quintile and the lowest BM quintile, and equal to 0 if stock is in the lowest Accrual quintile and the highest BM quintile. Exclude if book equity (ceq) is negative."
AdExp,"Chan, Lakonishok and Sougiannis",2001,Advertising Expense,JF,Advertising expense (xad) over market value of equity (shrout*abs(prc))
AgeIPO,Ritter,1991,IPO and age,JF,Age is  (current year -  founding year from Jay Ritter's dataset). Exclude if IndIPO == 0.
AM,Fama and French,1992,Total assets to market,JF,Total assets (at) divided by market value of equity.
AnalystRevision,"Hawkins, Chamberlin, Daniel",1984,EPS forecast revision,FAJ,"keep fpi == ""1"", last obs each month.  Signal is meanest / last month's meanest."
AnalystValue,Frankel and Lee,1998,Analyst Value,JAE,"Value based on a three-stage dividend discount model and analyst forecasts, scaled by market value.  See code for details."
AnnouncementReturn,"Chan, Jegadeesh and Lakonishok",1996,Earnings announcement return,JF,Get announcement date for quarterly earnings from IBES (fpi = 6). AnnouncementReturn is the sum of (ret - mktrf + rf) from two days before an earnings announcement to 1 days after the announcement.
AOP,Frankel and Lee,1998,Analyst Optimism,JAE,"AnalystValue (defined above) minus IntrinsicValue (defined above), divided by abs(IntrinsicValue)."
AssetGrowth,"Cooper, Gulen and Schill",2008,Asset growth,JF,Annual growth rate of total assets (at)
Beta,Fama and MacBeth,1973,CAPM beta,JPE,Coefficient of a 60-month rolling window regression of monthly stock returns minus the riskfree rate on market return minus the risk free rate (ewretd - rf). Exclude if estimate based on less than 20 months of returns.
BetaFP,Frazzini and Pedersen,2014,Frazzini-Pedersen Beta,JFE,"Using daily data, call tempRi the sum of today's return and the past 2 days, call tempRm the sum of today's mkt return and the past 2 days mkt return.  Regress return on tempRi and tempRm using past 5 years of data, with a minimum of 3 years.  BetaFP is the square root of the r square from this regression times the ratio of the idiosyncratic stock vol and the market vol."
BetaLiquidityPS,Pastor and Stambaugh,2003,Pastor-Stambaugh liquidity beta,JPE,"Monthly excess return (ret -rf) regressed on innovations in liquidity from Pastor's website (\url{https://faculty.chicagobooth.edu/lubos.pastor/research/liq_data_1962_2018.txt}). Use 60 month rolling window regression, and require at least 36 non-missing observations."
BetaTailRisk,Kelly and Jiang,2014,Tail risk beta,RFS,"Each month, compute the 5th percentile over daily returns over all firms. For all daily return observations with return below that 5th percentile, compute the average of (log(ret/5th percentile of cross-sectional return distribution). Call that average tailEX. BetaTailRisk is the coefficient of a 120-month rolling regression of a firm's stock return on tailEX. Exclude if price less than 5 or share code greater than 11."
BidAskSpread,Amihud and Mendelsohn,1986,Bid-ask spread,JFE,Effective bid ask spread based on Corwin-Schulz scaled by stock price.
BM,"Rosenberg, Reid, and Lanstein",1985,Book to market using most recent ME,JF,Log of annual book equity (ceq) over market equity.
BMdec,Fama and French,1992,Book to market using December ME,JPM,BM using most recent December value of market equity.
BookLeverage,Fama and French,1992,Book leverage (annual),JF,"Total assets (at) divided by book value of equity plus deferred taxes (txditc) and preferred stock. Equity is shareholder equity (seq) if available, or book equity (ceq) plus preferred stock (pstk, if missing pstkrv, if missing pstkl), or total assets minus total liabilities (lt)."
BPEBM,"Penman, Richardson and Tuna",2007,Leverage component of BM,JAR,"BP - EBM, where BP = (ceq + tstkp - dvpa)/(shrout*abs(prc)), and EBM is defined above. Exclude if price less than 5."
BrandInvest,"Belo, Lin and Vitorino",2014,Brand capital investment,RED,"Advertising expenses (xad) divided by BrandCapital. Brand capital is computed by the perpetual inventory method. In the first year, brand capital is advertising expense divided by (.5 + .1). In subsequent years, we let brand capital depreciate with a rate of .5 and add current advertising expenses. Brand capital is scaled by total assets (at). Set to missing if advertising expense is missing.  Drop if 1st digit of sic = 4 or 6, and keep only Dec fiscal year ends."
Cash,Palazzo,2012,Cash to assets,JFE,Ratio of quarterly cash and short-term investments (cheq) and total assets (atq).
CashProd,Chandrashekar and Rao,2009,Cash Productivity,WP,Calculate market value of equity (mve_c) as absolute price (prc) times number of shares outstanding (shrout). Cash productivity is equal to the difference between mve_c and total assets (at) divided by cash and short-term investments (che).
CBOperProf,Ball et al.,2016,Cash-based operating profitability,JFE,"Revenue (revt) minus cost (cogs) - (administrative expenses (xsga) - R&D expenses (xrd))  minus annual change in receivables (rect), annual change in investment (invt) and annual change in prepaid expenses, plus annual change in current deferred revenue (drc), long-term deferred revenue (drlt), accounts payable (ap) and accrued expenses (xacc), all divided by total assets (at) in year t. Replace all variables in the numerator with 0 if they are missing. Exclude if share code is greater 11, market value of equity, BM or total assets are missing, or if SIC code between 6000 and 6999."
CF,"Lakonishok, Shleifer, Vishny",1994,Cash flow to market,JF,Net income (ib) plus depreciation (dp) divided by market equity. Exclude NASDAQ stocks.
cfp,"Desai, Rajgopal, Venkatachalam",2004,Operating Cash flows to price,AR,"Operating cash-flow (oancf) divided by market value of equity. If operating cash-flow is missing, replace by difference betwee net income (ib) and level of accruals, where the latter is the annual change in current assets (act) minus the annual change in cash and short-term investments (che), minus the annual change in current liabilities (lct) plus the annual change in debt in current liabilities (dlc) plus the annual change in payable income taxes (txp) plus depreciation (dp)."
ChAssetTurnover,Soliman,2008,Change in Asset Turnover,AR,Annual change in AssetTurnover (defined above). Exclude if price less than 5.
ChEQ,Lockwood and Prombutr,2010,Growth in book equity,JFR,Ratio of book equity (ceq) to book equity in the previous year. Include only if book equity is positive this year and last year.
ChForecastAccrual,Barth and Hutton,2004,Change in Forecast and Accrual,RAS,"Within upper half of Accruals distribution, equal to 1 if mean earnings estimate increased relative to the previous month. 0 if it decreased."
ChInv,Thomas and Zhang,2002,Inventory Growth,RAS,12 month change in inventory (invt) divided by average total assets.
ChInvIA,Abarbanell and Bushee,1998,Change in capital inv (ind adj),AR,"Growth in capital expenditure (capx) minus average growth in capital expenditure in the same industry (two-digit SIC). If capx is missing, capital expenditure is defined as the annual change in property, plant and equipment (ppent). Capital expenditure growth is defined as the percentage growth of capx today relative to the average capx over the previous two years (.5*(capx$_{t-1}$ + capx$_{t-2}$), or as percentage growth relative to the previous year only if t-2 is missing."
ChNNCOA,Soliman,2008,Change in Net Noncurrent Op Assets,AR,Twelve-month change in noncurrent operating assets. Noncurrent operating assets is ( (at - act - ivao) - (lt - dlc - dltt) )/at.
ChNWC,Soliman,2008,Change in Net Working Capital,AR,Twelve-month change in net working capital. Net working capital is ( (act - che) - (lct - dlc) )/at
ChTax,Thomas and Zhang,2011,Change in Taxes,JAR,"4-quarter change in quarterly total taxes (txtq), scaled by lagged total assets (at)."
CompEquIss,Daniel and Titman,2006,Composite equity issuance,JF,5 year growth rate of market value of equity minus 5 year stock return.
CompositeDebtIssuance,"Lyandres, Sun and Zhang",2008,Composite debt issuance,RFS,Log of long-term debt (dltt) plus debt in current liabilties (dlc) minus log of the same variable 5 years ago.
ConvDebt,Valta,2016,Convertible debt indicator,JFQA,Binary variable equal to 1 if deferred charges (dc) greater than 0 or common shares reserved for convertible debt (cshrc) greater than 0.
Coskewness,Harvey and Siddique,2000,Coskewness,JF,"Signal is the sample counterpart of $E[\tilde{r}_{it} \tilde{r}_{mt}^2]/( SD[\tilde{r}_{it} ] SD[\tilde{r}_{mt}]^2$ where $\tilde{r}_{it}$ is the de-meaned stock excess return and $\tilde{r}_{mt}$ is the de-meaned market excess return.  Signal is computed using the past 60 months of monthly data, and using the NYSE/AMEX CRSP VW index for the market (msic).  See code for details."
CustomerMomentum,Cohen and Frazzini,2008,Customer momentum,JF,Based on firms' principals customers from Compustat Segment data as in Cohen and Frazzini.
DebtIssuance,Spiess and Affleck-Graves,1999,Debt Issuance,JFE,Equal to 1 if debt issuance (dltis) greater 0 and 0 otherwise. Exclude if share code > 11 or missing book-to-market.
DelBreadth,"Chen, Hong and Stein",2002,Breadth of ownership,JFE,Quarterly change in the number of institutional owners (numinstowners) from 13F data. Exclude if in the lowest quintile of stocks by market value of equity (based on NYSE stocks only).
DelCOA,Richardson et al.,2005,Change in current operating assets,JAE,"Difference in current operating assets (total current assets (act) minus cash and short-term investments (che)) between years t-1 and t, scaled by average total assets (at) in years t-1 and t."
DelCOL,Richardson et al.,2005,Change in current operating liabilities,JAE,"Difference in current operating liabilities (total current liabilities (lct) minus debt in current liabilities (dlc)) between years t-1 and t, scaled by average total assets (at) in years t-1 and t."
DelEqu,Richardson et al.,2005,Change in equity to assets,JAE,"Difference in book equity (ceq) between years t-1 and t, scaled by average total assets (at) in years t-1 and t."
DelFINL,Richardson et al.,2005,Change in financial liabilities,JAE,"Difference in financial liabilities (sum of long-term debt (dltt), current liabilitites (dlc) and preferred stock (pstk)) between years t-1 and t, scaled by average total assets (at) in years t-1 and t."
DelLTI,Richardson et al.,2005,Change in long-term investment,JAE,"Difference in investment and advances (ivao) between years t-1 and t, scaled by average total assets (at) in years t-1 and t."
DelNetFin,Richardson et al.,2005,Change in net financial assets,JAE,"Compute the sum of short-term investments (ivst) and investments and advances (ivao) minus the sum of long-term debt (dltt), debt in current liabilities (dlc) and preferred stock capital. Divide the difference between the current and one-year lagged sum by total assets (at) averaged over the current and previous fiscal years."
DivInit,"Michaely, Thaler and Womack",1995,Dividend Initiation,JF,"Keep only distcd 2nd digit = 2 or 3.  Define dividend initiation as having paid a dividend in month t (divamt > 0), and not having paid a dividend in the last 24 months.  DivInit is equal to 1 if a dividend was initiated in the past 6 months, and 0 for all other stocks."
DivSeason,Hartzmark and Salomon,2013,Dividend seasonality,JFE,"Drop if 3rd digit of distcd = 2 or >= 6.  Assign DivSeason = 0 if there was a dividend paid in the last 12 months.  Replace DivSeason = 1 if the third digit of disctcd is 3, 0, or 1, and a positive dividend was paid 2, 5, 8, or 11 months ago, if the third digit is 4 and a dividend was paid 5 or 11 months ago, or if the third digit is 5 and a dividiend was paid 11 months ago."
DivYieldST,Litzenberger and Ramaswamy,1979,Predicted div yield next month,JF,"Using CRSP distributions, keep only distcd beginning in 12 and if the third digit of distcd is 3, 4, or 5.  Also keep only if stock paid a dividend in the last 12 months.  Define Ediv1 = div 2 months ago if distcd's 3rd digit is 0, 1, or 3.  Define Ediv1 = div 5 months ago if the distcd 3rd digit is 4.  Define Ediv = div 11 months ago if the distcd 3rd digit is 5.  Define Edy1 as Ediv1/abs(prc).  Finally, discretize Edy1 to smooth around the huge mass at 0 as follows: DivYieldST = 0 if Edy1 = 0, 1 if Edy is between 0 and 0.005, 2 if Edy1 is between 0.005 and 0.010, and 3 if Edy > 0.010."
dNoa,"Hirshleifer, Hou, Teoh, Zhang",2004,change in net operating assets,JAE,"12-month growth in Net Operating Assets scaled by lagged total assets (at). Net Operating assets are operating assets minus operating liabilities. Operating assets are total assets (at) minus cash- and short-term investments (che), operating liabilities are total assets minus long-term debt (dltt), minority interest (mib), deferred charges (dlc), book equity (ceq) and preferred stock (pstk), all items (except at and ceq) replaced with 0 if missing."
DolVol,"Brennan, Chordia, Subra",1998,Past trading volume,JFE,Log of two-month lagged trading volume (vol) times two-month lagged price (prc).
EarningsConsistency,Alwathainani,2009,Earnings consistency,BAR,"Average earnings growth over previous 48 months. Earnings growth is defined as EPS (epspx) minus EPS 12 months ago divided by average EPS 12 and 24 months ago. Exclude if price less than 5, absolute value of 12 month earnings growth greater 600%, or earnings growth and earnings growth 12 months ago have different signs."
EarningsSurprise,"Foster, Olsen and Shevlin",1984,Earnings Surprise,AR,"EPS (epspxq) minus EPS twelve months ago - Drift, scaled by standard deviation of that expression. Drift is the average earnings growth (EPS - EPS twelve months ago) over the past two years. Exclude if price less than 5"
EarnSupBig,Hou,2007,Earnings surprise of big firms,RFS,Average monthly value of EarningsSurprise (defined above) of the 30% largest companies by market value of equity in the same Fama-French 48 industry. Exclude the largest 30% of companies for EarnSupBig (not to compute the anomaly)
EBM,"Penman, Richardson and Tuna",2007,Enterprise component of BM,JAR,(ceq + che - dltt - dlc - dc - dvpa+ tstkp ) / (mve\_c + che - dltt - dlc - dc - dvpa+ tstkp). Exclude if price less than 5.
EntMult,Loughran and Wellman,2011,Enterprise Multiple,JFQA,"Market value of equity + long-term debt (dltt) + debt in current liabilities (dlc) + deferred charges (dc) - cash and short-term investments (che) , divided by operating income (oibdp). Exclude if missing book equity or negative operating income."
EP,Basu,1977,Earnings-to-Price Ratio,JF,"ib / lag(market value of equity, 6 months).  NYSE stocks only.  Exclude if EP < 0.  Lag simulates the Dec 31 market equity used in original paper"
EquityDuration,"Dechow, Sloan and Soliman",2004,Equity Duration,RAS,see code
ExchSwitch,Dharan and Ikenberry,1995,Exchange Switch,JF,"Binary variable equal to 1 if a firm switched from AMEX or NASDAQ to NYSE within the past year, or from NASDAQ to AMEX within the past year."
FEPS,"Cen, Wei, and Zhang",2006,Analyst earnings per share,WP,"Using IBES unadjusted forecasts, keep fpi == 1, signal is meanest."
FirmAge,Barry and Brown,1984,Firm age based on CRSP,JFE,Months since start of CRSP coverage.
FirmAgeMom,Zhang,2004,Firm Age - Momentum,JF,"6 month return, restricted to the bottom quintile of the cross-sectional firm age distribution. Exclude if price less than 5 or firm younger than 12 months."
ForecastDispersion,"Diether, Malloy and Scherbina",2002,EPS Forecast Dispersion,JF,Keep fpi = 1 and fpedats > statpers + 30.  Standard deviation of earnings estimates (stdev\_est) scaled by mean earnings estimate.
Frontier,Nguyen and Swanson,2009,Efficient frontier index,JFQA,"Frontier is the residual of a regression of log(BM) on log(book equity (ceq)), long-term debt (dltt) to assets (at), capital expenditures (capx) to revenue (sale), R&D expense (xrd) to revenue, advertising expense (xad) to revenue, property plant and equipment (ppent) to assets, EBIT (ebitda) to assets, and dummies for Fama-French's 48 industry definitions. Regression is updated each month with a rolling window of 60 months."
GP,Novy-Marx,2013,gross profits / total assets,JFE,"Revenue (sale) - cost of goods solds (cogs), divided by  total assets (at).  Drop if financial."
GrAdExp,Lou,2014,Growth in advertising expenses,RFS,"Log of advertising expense (xad) minus log of advertising expense last year. Exclude if price less than 5, xad less than .1 or stock in the lowest decile of market value of equity."
grcapx,Anderson and Garcia-Feijoo,2006,Change in capex (two years),JF,"Growth rate of capital expenditures (capx) relative to two years ago.   If capx is missing, replace with annual change in property, plant and equipment (ppent)."
grcapx3y,Anderson and Garcia-Feijoo,2006,Change in capex (three years),JF,"Capital expenditures (capx) divided by the sum of capital expenditures from year - 1, year -2, and year -3.   If capx is missing, replace with annual change in property, plant and equipment (ppent)."
GrLTNOA,"Fairfield, Whisenant and Yohn",2003,Growth in long term operating assets,AR,"Annual growth in net operating assets, minus accruals. Net operating assets are (rect + invt + ppent + aco + intan + ao- ap- lco- lo) / at. Accruals are ( rect-l12.rect + invt - l12.invt + aco - l12.aco - (ap - l12.ap + lco - l12.lco) - dp ) / ((at + l12.at)/2)"
GrSaleToGrInv,Abarbanell and Bushee,1998,Sales growth over inventory growth,AR,"Percentage growth in sales (sale) relative to average sales of t-1 and t-2, minus percentage growth in inventory (invt) relative to average inventory of t-1 and t-2. Both growth terms are calculated relative to t-1 only if t-2 is missing."
GrSaleToGrOverhead,Abarbanell and Bushee,1998,Sales growth over overhead growth,AR,"GrSaleToGrOverHead = Percentage growth in sales (sale) relative to average sales of t-1 and t-2, minus percentage growth in administrative expenses (xsga) relative to average administrative expenses of t-1 and t-2. Both growth terms are calculated relative to t-1 only if t-2 is missing."
Herf,Hou and Robinson,2006,Industry concentration (sales),JF,"Three-year rolling average of the three digit industry Herfindahl index based on firm revenue (sale). Exclude regulated industries (4011, 4210, 4213 & year $\leq$ 1980; 4512 & year $\leq$ 1978, 4812, 4813 & year $\leq$ 1982, 4900-4999 in any year)"
HerfAsset,Hou and Robinson,2006,Industry concentration (assets),JF,"Three-year rolling average of the three digit industry Herfindahl index based on firm assets (at). Exclude regulated industries (4011, 4210, 4213 & year $\leq$ 1980; 4512 & year $\leq$ 1978, 4812, 4813 & year $\leq$ 1982, 4900-4999 in any year)"
HerfBE,Hou and Robinson,2006,Industry concentration (equity),JF,"Three-year rolling average of the three digit industry Herfindahl index based on firm book equity. Exclude regulated industries (4011, 4210, 4213 & year $\leq$ 1980; 4512 & year $\leq$ 1978, 4812, 4813 & year $\leq$ 1982, 4900-4999 in any year)"
High52,George and Hwang,2004,52 week high,JF,Price (prc/cfacshr) divided by the maximum price over the previous 12 months.
hire,"Bazdresch, Belo and Lin",2014,Employment growth,JPE,"Change in number of employees (emp) between t -1 and t, scaled by average number of employees in t-1 and t. Replace hire with 0 if emp or lagged emp is missing."
IdioRisk,Ang et al.,2006,Idiosyncratic risk,JF,Standard deviation of residuals from CAPM regressions using the past month of daily data.  Value weighted
IdioVol3F,Ang et al.,2006,Idiosyncratic risk (3 factor),JF,Standard deviation of residuals from Fama-French three factor regressions using the past month of daily data.  Value weighted
IdioVolAHT,"Ali, Hwang, and Trombley",2003,Idiosyncratic risk (AHT),JFE,Standard deviation of residuals from CAPM regressions using the past year of daily data. Require at least 100 non-missing observations.
Illiquidity,Amihud,2002,Amihud's illiquidity,JFM,Past twelve month average of: daily return (abs(ret)) divided by turnover((abs(prc)*vol)
IndIPO,Ritter,1991,Initial Public Offerings,JF,1 if IPO in the past 6-36 months.  0 otherwise.  IPO dates are taken from Jay Ritter's IPO data available at: http://bear.warrington.ufl.edu/ritter/ipodata.htm.  Missing IPO dates imply IndIPO = 0
IndMom,Grinblatt and Moskowitz,1999,Industry Momentum,JFE,Weighted average of firm-level 6 month buy-and-hold return. Average is taken over two digit industries each month and weights are based on market value of equity.
IndRetBig,Hou,2007,Industry return of big firms,RFS,Average monthly return (ret) of the 30% largest companies by market value of equity in the same Fama-French 48 industry. Exclude the largest 30% of companies for IndRetBig (not to compute the anomaly!)
IntanBM,Daniel and Titman,2006,Intangible return using BM,JF,"In each month, run a cross-sectional regression of a firm's five-year stock return on 5 year lagged BM (defined above) and a constructed regressor that is the change in BM from 5 years ago to today plus the five-year stock return. The residual from that regression is IntanBM."
IntanCFP,Daniel and Titman,2006,Intangible return using CFtoP,JF,"In each month, run a cross-sectional regression of a firm's five-year stock return on the 5 year lagged  CFP = (net income (ni) plus depreciation (dp))/market value of equity and a constructed regressor that is the change in CFP from 5 years ago to today plus the five-year stock return. The residual from that regression is IntanCFP.
"
IntanEP,Daniel and Titman,2006,Intangible return using EP,JF,"In each month, run a cross-sectional regression of a firm's five-year stock return on the 5 year lagged  EP = net income (ni)/market value of equity and a constructed regressor that is the change in EP from 5 years ago to today plus the five-year stock return. The residual from that regression is IntanEP.
"
IntanSP,Daniel and Titman,2006,Intangible return using Sale2P,JF,"In each month, run a cross-sectional regression of a firm's five-year stock return on 5 year lagged SP (defined above) and a constructed regressor that is the change in SP from 5 years ago to today plus the five-year stock return. The residual from that regression is IntanSP."
IntMom,Novy-Marx,2012,Intermediate Momentum,JFE,Stock return between months t-12 and t-6
Investment,"Titman, Wei and Xie",2004,Investment to revenue,JFQA,Ratio of capital investment (capx) to revenue (revt) divided by the firm-specific 36-month rolling mean of that ratio. Exclude if revenue less than \$10m.
InvestPPEInv,"Lyandres, Sun and Zhang",2008,change in ppe and inv/assets,RFS,"One-year change in property, plants and equipment (ppegt) plus one year change in inventory (invt), scaled by one-year lagged assets (at)."
InvGrowth,Belo and Lin,2012,Inventory Growth,RFS,"Defate invt growth using gnp deflator.  Signal is deflated invt growth rate from fiscal year t to fiscal year t-1.  Drop if 1 digit sic code is 4 or 6, or if at or ppent <= 0"
IO_ShortInterest,Asquith Pathak and Ritter,2005,Inst own among high short interest,JFE,"Exclude all stocks with short interest (ShortInterest) below 99th percentile. IO\_ShortInterest is institutional ownership (instown\_perc).  Keep NYSE Only.  There may be issues with our use of Compustat Short Interest data, rather than exchange-purchased data used by the OP.  See note for the ShortInterest signal."
Leverage,Bhandari,1988,Market leverage,JFE,Total liabilities (lt) divided by market value of equity.
LRreversal,De Bondt and Thaler,1985,Long-run reversal,JF,Stock return between months t-36 and t-13.
MaxRet,"Bali, Cakici, and Whitelaw",2010,Maximum return over month,JF,Maximum of daily returns (ret) over the previous month
MeanRankRevGrowth,"Lakonishok, Shleifer, Vishny",1994,Revenue Growth Rank,JF,"Rank firms by their annual revenue growth each year over the past 5 years. MeanRankRevGrowth is the weighted average of ranks over the past 5 years, that is, MeanRankRevGrowth = (5*Rank$_{t-1}$ + 4*Rank$_{t-2}$ + 3*Rank$_{t-3}$ + 2*Rank$_{t-4}$ + 1*Rank$_{t-5}$)/15. Exclude NASDAQ stocks."
Mom12m,Jegadeesh and Titman,1993,Momentum (12 month),JF,Stock return between months t-12 and t-1
Mom12mOffSeason,Heston and Sadka,2008,Momentum without the seasonal part,JFE,Average return in  other months over the previous year.
Mom6m,Jegadeesh and Titman,1993,Momentum (6 month),JF,Stock return between months t-6 and t-1
MomOffSeason,Heston and Sadka,2008,Off season long-term reversal,JFE,Average return in other months over the preceding 2-5 years.
